Frame 1: 608 bytes on wire (4864 bits), 608 bytes captured (4864 bits) on interface 0
Ethernet II, Src: Vmware_ec:01:a5 (00:50:56:ec:01:a5), Dst: Vmware_23:f2:20 (00:50:56:23:f2:20)
Internet Protocol Version 4, Src: 208.89.14.135 (208.89.14.135), Dst: 192.168.73.3 (192.168.73.3)
Transmission Control Protocol, Src Port: http (80), Dst Port: 33906 (33906), Seq: 1, Ack: 1, Len: 554
Hypertext Transfer Protocol
Line-based text data: application/x-javascript

Frame 2: 54 bytes on wire (432 bits), 54 bytes captured (432 bits) on interface 0
Ethernet II, Src: Vmware_23:f2:20 (00:50:56:23:f2:20), Dst: Vmware_ec:01:a5 (00:50:56:ec:01:a5)
Internet Protocol Version 4, Src: 192.168.73.3 (192.168.73.3), Dst: 208.89.14.135 (208.89.14.135)
Transmission Control Protocol, Src Port: 33906 (33906), Dst Port: http (80), Seq: 1, Ack: 555, Len: 0

Frame 3: 54 bytes on wire (432 bits), 54 bytes captured (432 bits) on interface 0
Ethernet II, Src: Vmware_23:f2:20 (00:50:56:23:f2:20), Dst: Vmware_ec:01:a5 (00:50:56:ec:01:a5)
Internet Protocol Version 4, Src: 192.168.73.3 (192.168.73.3), Dst: 52.84.33.92 (52.84.33.92)
Transmission Control Protocol, Src Port: 45679 (45679), Dst Port: http (80), Seq: 1, Ack: 1, Len: 0

Frame 4: 60 bytes on wire (480 bits), 60 bytes captured (480 bits) on interface 0
Ethernet II, Src: Vmware_ec:01:a5 (00:50:56:ec:01:a5), Dst: Vmware_23:f2:20 (00:50:56:23:f2:20)
Internet Protocol Version 4, Src: 52.84.33.92 (52.84.33.92), Dst: 192.168.73.3 (192.168.73.3)
Transmission Control Protocol, Src Port: http (80), Dst Port: 45679 (45679), Seq: 1, Ack: 2, Len: 0

Frame 5: 54 bytes on wire (432 bits), 54 bytes captured (432 bits) on interface 0
Ethernet II, Src: Vmware_23:f2:20 (00:50:56:23:f2:20), Dst: Vmware_ec:01:a5 (00:50:56:ec:01:a5)
Internet Protocol Version 4, Src: 192.168.73.3 (192.168.73.3), Dst: 216.58.219.206 (216.58.219.206)
Transmission Control Protocol, Src Port: 47855 (47855), Dst Port: http (80), Seq: 1, Ack: 1, Len: 0

Frame 6: 60 bytes on wire (480 bits), 60 bytes captured (480 bits) on interface 0
Ethernet II, Src: Vmware_ec:01:a5 (00:50:56:ec:01:a5), Dst: Vmware_23:f2:20 (00:50:56:23:f2:20)
Internet Protocol Version 4, Src: 216.58.219.206 (216.58.219.206), Dst: 192.168.73.3 (192.168.73.3)
Transmission Control Protocol, Src Port: http (80), Dst Port: 47855 (47855), Seq: 1, Ack: 2, Len: 0

Frame 7: 54 bytes on wire (432 bits), 54 bytes captured (432 bits) on interface 0
Ethernet II, Src: Vmware_23:f2:20 (00:50:56:23:f2:20), Dst: Vmware_ec:01:a5 (00:50:56:ec:01:a5)
Internet Protocol Version 4, Src: 192.168.73.3 (192.168.73.3), Dst: 199.16.156.75 (199.16.156.75)
Transmission Control Protocol, Src Port: 39730 (39730), Dst Port: http (80), Seq: 1, Ack: 1, Len: 0

Frame 8: 60 bytes on wire (480 bits), 60 bytes captured (480 bits) on interface 0
Ethernet II, Src: Vmware_ec:01:a5 (00:50:56:ec:01:a5), Dst: Vmware_23:f2:20 (00:50:56:23:f2:20)
Internet Protocol Version 4, Src: 199.16.156.75 (199.16.156.75), Dst: 192.168.73.3 (192.168.73.3)
Transmission Control Protocol, Src Port: http (80), Dst Port: 39730 (39730), Seq: 1, Ack: 2, Len: 0

Frame 9: 54 bytes on wire (432 bits), 54 bytes captured (432 bits) on interface 0
Ethernet II, Src: Vmware_23:f2:20 (00:50:56:23:f2:20), Dst: Vmware_ec:01:a5 (00:50:56:ec:01:a5)
Internet Protocol Version 4, Src: 192.168.73.3 (192.168.73.3), Dst: 173.194.123.58 (173.194.123.58)
Transmission Control Protocol, Src Port: 55259 (55259), Dst Port: http (80), Seq: 1, Ack: 1, Len: 0

Frame 10: 60 bytes on wire (480 bits), 60 bytes captured (480 bits) on interface 0
Ethernet II, Src: Vmware_ec:01:a5 (00:50:56:ec:01:a5), Dst: Vmware_23:f2:20 (00:50:56:23:f2:20)
Internet Protocol Version 4, Src: 173.194.123.58 (173.194.123.58), Dst: 192.168.73.3 (192.168.73.3)
Transmission Control Protocol, Src Port: http (80), Dst Port: 55259 (55259), Seq: 1, Ack: 2, Len: 0

Frame 11: 54 bytes on wire (432 bits), 54 bytes captured (432 bits) on interface 0
Ethernet II, Src: Vmware_23:f2:20 (00:50:56:23:f2:20), Dst: Vmware_ec:01:a5 (00:50:56:ec:01:a5)
Internet Protocol Version 4, Src: 192.168.73.3 (192.168.73.3), Dst: 173.194.206.188 (173.194.206.188)
Transmission Control Protocol, Src Port: 49701 (49701), Dst Port: https (443), Seq: 1, Ack: 1, Len: 0

Frame 12: 60 bytes on wire (480 bits), 60 bytes captured (480 bits) on interface 0
Ethernet II, Src: Vmware_ec:01:a5 (00:50:56:ec:01:a5), Dst: Vmware_23:f2:20 (00:50:56:23:f2:20)
Internet Protocol Version 4, Src: 173.194.206.188 (173.194.206.188), Dst: 192.168.73.3 (192.168.73.3)
Transmission Control Protocol, Src Port: https (443), Dst Port: 49701 (49701), Seq: 1, Ack: 2, Len: 0

Frame 13: 54 bytes on wire (432 bits), 54 bytes captured (432 bits) on interface 0
Ethernet II, Src: Vmware_23:f2:20 (00:50:56:23:f2:20), Dst: Vmware_ec:01:a5 (00:50:56:ec:01:a5)
Internet Protocol Version 4, Src: 192.168.73.3 (192.168.73.3), Dst: 173.194.206.104 (173.194.206.104)
Transmission Control Protocol, Src Port: 33020 (33020), Dst Port: http (80), Seq: 1, Ack: 1, Len: 0

Frame 14: 60 bytes on wire (480 bits), 60 bytes captured (480 bits) on interface 0
Ethernet II, Src: Vmware_ec:01:a5 (00:50:56:ec:01:a5), Dst: Vmware_23:f2:20 (00:50:56:23:f2:20)
Internet Protocol Version 4, Src: 173.194.206.104 (173.194.206.104), Dst: 192.168.73.3 (192.168.73.3)
Transmission Control Protocol, Src Port: http (80), Dst Port: 33020 (33020), Seq: 1, Ack: 2, Len: 0

Frame 15: 54 bytes on wire (432 bits), 54 bytes captured (432 bits) on interface 0
Ethernet II, Src: Vmware_23:f2:20 (00:50:56:23:f2:20), Dst: Vmware_ec:01:a5 (00:50:56:ec:01:a5)
Internet Protocol Version 4, Src: 192.168.73.3 (192.168.73.3), Dst: 199.187.193.130 (199.187.193.130)
Transmission Control Protocol, Src Port: 57204 (57204), Dst Port: http (80), Seq: 1, Ack: 1, Len: 0

Frame 16: 60 bytes on wire (480 bits), 60 bytes captured (480 bits) on interface 0
Ethernet II, Src: Vmware_ec:01:a5 (00:50:56:ec:01:a5), Dst: Vmware_23:f2:20 (00:50:56:23:f2:20)
Internet Protocol Version 4, Src: 199.187.193.130 (199.187.193.130), Dst: 192.168.73.3 (192.168.73.3)
Transmission Control Protocol, Src Port: http (80), Dst Port: 57204 (57204), Seq: 1, Ack: 2, Len: 0

Frame 17: 54 bytes on wire (432 bits), 54 bytes captured (432 bits) on interface 0
Ethernet II, Src: Vmware_23:f2:20 (00:50:56:23:f2:20), Dst: Vmware_ec:01:a5 (00:50:56:ec:01:a5)
Internet Protocol Version 4, Src: 192.168.73.3 (192.168.73.3), Dst: 52.84.27.118 (52.84.27.118)
Transmission Control Protocol, Src Port: 36886 (36886), Dst Port: http (80), Seq: 1, Ack: 1, Len: 0

Frame 18: 60 bytes on wire (480 bits), 60 bytes captured (480 bits) on interface 0
Ethernet II, Src: Vmware_ec:01:a5 (00:50:56:ec:01:a5), Dst: Vmware_23:f2:20 (00:50:56:23:f2:20)
Internet Protocol Version 4, Src: 52.84.27.118 (52.84.27.118), Dst: 192.168.73.3 (192.168.73.3)
Transmission Control Protocol, Src Port: http (80), Dst Port: 36886 (36886), Seq: 1, Ack: 2, Len: 0

Frame 19: 77 bytes on wire (616 bits), 77 bytes captured (616 bits) on interface 0
Ethernet II, Src: Vmware_23:f2:20 (00:50:56:23:f2:20), Dst: Vmware_ec:01:a5 (00:50:56:ec:01:a5)
Internet Protocol Version 4, Src: 192.168.73.3 (192.168.73.3), Dst: 192.168.73.2 (192.168.73.2)
User Datagram Protocol, Src Port: 36490 (36490), Dst Port: domain (53)
Domain Name System (query)

Frame 20: 77 bytes on wire (616 bits), 77 bytes captured (616 bits) on interface 1
Ethernet II, Src: 00:00:00_00:00:00 (00:00:00:00:00:00), Dst: 00:00:00_00:00:00 (00:00:00:00:00:00)
Internet Protocol Version 4, Src: 127.0.0.1 (127.0.0.1), Dst: 127.0.1.1 (127.0.1.1)
User Datagram Protocol, Src Port: 48956 (48956), Dst Port: domain (53)
Domain Name System (query)

Frame 21: 77 bytes on wire (616 bits), 77 bytes captured (616 bits) on interface 1
Ethernet II, Src: 00:00:00_00:00:00 (00:00:00:00:00:00), Dst: 00:00:00_00:00:00 (00:00:00:00:00:00)
Internet Protocol Version 4, Src: 127.0.0.1 (127.0.0.1), Dst: 127.0.1.1 (127.0.1.1)
User Datagram Protocol, Src Port: 48956 (48956), Dst Port: domain (53)
Domain Name System (query)

Frame 22: 77 bytes on wire (616 bits), 77 bytes captured (616 bits) on interface 0
Ethernet II, Src: Vmware_23:f2:20 (00:50:56:23:f2:20), Dst: Vmware_ec:01:a5 (00:50:56:ec:01:a5)
Internet Protocol Version 4, Src: 192.168.73.3 (192.168.73.3), Dst: 192.168.73.2 (192.168.73.2)
User Datagram Protocol, Src Port: emperion (1282), Dst Port: domain (53)
Domain Name System (query)

Frame 23: 962 bytes on wire (7696 bits), 962 bytes captured (7696 bits) on interface 0
Ethernet II, Src: Vmware_23:f2:20 (00:50:56:23:f2:20), Dst: Vmware_ec:01:a5 (00:50:56:ec:01:a5)
Internet Protocol Version 4, Src: 192.168.73.3 (192.168.73.3), Dst: 104.25.10.6 (104.25.10.6)
Transmission Control Protocol, Src Port: 43002 (43002), Dst Port: https (443), Seq: 1, Ack: 1, Len: 908
Secure Sockets Layer

Frame 24: 60 bytes on wire (480 bits), 60 bytes captured (480 bits) on interface 0
Ethernet II, Src: Vmware_ec:01:a5 (00:50:56:ec:01:a5), Dst: Vmware_23:f2:20 (00:50:56:23:f2:20)
Internet Protocol Version 4, Src: 104.25.10.6 (104.25.10.6), Dst: 192.168.73.3 (192.168.73.3)
Transmission Control Protocol, Src Port: https (443), Dst Port: 43002 (43002), Seq: 1, Ack: 909, Len: 0

Frame 25: 109 bytes on wire (872 bits), 109 bytes captured (872 bits) on interface 0
Ethernet II, Src: Vmware_ec:01:a5 (00:50:56:ec:01:a5), Dst: Vmware_23:f2:20 (00:50:56:23:f2:20)
Internet Protocol Version 4, Src: 192.168.73.2 (192.168.73.2), Dst: 192.168.73.3 (192.168.73.3)
User Datagram Protocol, Src Port: domain (53), Dst Port: 36490 (36490)
Domain Name System (response)

Frame 26: 133 bytes on wire (1064 bits), 133 bytes captured (1064 bits) on interface 0
Ethernet II, Src: Vmware_ec:01:a5 (00:50:56:ec:01:a5), Dst: Vmware_23:f2:20 (00:50:56:23:f2:20)
Internet Protocol Version 4, Src: 192.168.73.2 (192.168.73.2), Dst: 192.168.73.3 (192.168.73.3)
User Datagram Protocol, Src Port: domain (53), Dst Port: emperion (1282)
Domain Name System (response)

Frame 27: 109 bytes on wire (872 bits), 109 bytes captured (872 bits) on interface 1
Ethernet II, Src: 00:00:00_00:00:00 (00:00:00:00:00:00), Dst: 00:00:00_00:00:00 (00:00:00:00:00:00)
Internet Protocol Version 4, Src: 127.0.1.1 (127.0.1.1), Dst: 127.0.0.1 (127.0.0.1)
User Datagram Protocol, Src Port: domain (53), Dst Port: 48956 (48956)
Domain Name System (response)

Frame 28: 133 bytes on wire (1064 bits), 133 bytes captured (1064 bits) on interface 1
Ethernet II, Src: 00:00:00_00:00:00 (00:00:00:00:00:00), Dst: 00:00:00_00:00:00 (00:00:00:00:00:00)
Internet Protocol Version 4, Src: 127.0.1.1 (127.0.1.1), Dst: 127.0.0.1 (127.0.0.1)
User Datagram Protocol, Src Port: domain (53), Dst Port: 48956 (48956)
Domain Name System (response)

Frame 29: 1434 bytes on wire (11472 bits), 1434 bytes captured (11472 bits) on interface 0
Ethernet II, Src: Vmware_ec:01:a5 (00:50:56:ec:01:a5), Dst: Vmware_23:f2:20 (00:50:56:23:f2:20)
Internet Protocol Version 4, Src: 104.25.10.6 (104.25.10.6), Dst: 192.168.73.3 (192.168.73.3)
Transmission Control Protocol, Src Port: https (443), Dst Port: 43002 (43002), Seq: 1, Ack: 909, Len: 1380

Frame 30: 54 bytes on wire (432 bits), 54 bytes captured (432 bits) on interface 0
Ethernet II, Src: Vmware_23:f2:20 (00:50:56:23:f2:20), Dst: Vmware_ec:01:a5 (00:50:56:ec:01:a5)
Internet Protocol Version 4, Src: 192.168.73.3 (192.168.73.3), Dst: 104.25.10.6 (104.25.10.6)
Transmission Control Protocol, Src Port: 43002 (43002), Dst Port: https (443), Seq: 909, Ack: 1381, Len: 0

Frame 31: 1434 bytes on wire (11472 bits), 1434 bytes captured (11472 bits) on interface 0
Ethernet II, Src: Vmware_ec:01:a5 (00:50:56:ec:01:a5), Dst: Vmware_23:f2:20 (00:50:56:23:f2:20)
Internet Protocol Version 4, Src: 104.25.10.6 (104.25.10.6), Dst: 192.168.73.3 (192.168.73.3)
Transmission Control Protocol, Src Port: https (443), Dst Port: 43002 (43002), Seq: 1381, Ack: 909, Len: 1380

Frame 32: 54 bytes on wire (432 bits), 54 bytes captured (432 bits) on interface 0
Ethernet II, Src: Vmware_23:f2:20 (00:50:56:23:f2:20), Dst: Vmware_ec:01:a5 (00:50:56:ec:01:a5)
Internet Protocol Version 4, Src: 192.168.73.3 (192.168.73.3), Dst: 104.25.10.6 (104.25.10.6)
Transmission Control Protocol, Src Port: 43002 (43002), Dst Port: https (443), Seq: 909, Ack: 2761, Len: 0

Frame 33: 1434 bytes on wire (11472 bits), 1434 bytes captured (11472 bits) on interface 0
Ethernet II, Src: Vmware_ec:01:a5 (00:50:56:ec:01:a5), Dst: Vmware_23:f2:20 (00:50:56:23:f2:20)
Internet Protocol Version 4, Src: 104.25.10.6 (104.25.10.6), Dst: 192.168.73.3 (192.168.73.3)
Transmission Control Protocol, Src Port: https (443), Dst Port: 43002 (43002), Seq: 2761, Ack: 909, Len: 1380
[3 Reassembled TCP Segments (4125 bytes): #29(1380), #31(1380), #33(1365)]
Secure Sockets Layer

Frame 34: 54 bytes on wire (432 bits), 54 bytes captured (432 bits) on interface 0
Ethernet II, Src: Vmware_23:f2:20 (00:50:56:23:f2:20), Dst: Vmware_ec:01:a5 (00:50:56:ec:01:a5)
Internet Protocol Version 4, Src: 192.168.73.3 (192.168.73.3), Dst: 104.25.10.6 (104.25.10.6)
Transmission Control Protocol, Src Port: 43002 (43002), Dst Port: https (443), Seq: 909, Ack: 4141, Len: 0

Frame 35: 833 bytes on wire (6664 bits), 833 bytes captured (6664 bits) on interface 0
Ethernet II, Src: Vmware_ec:01:a5 (00:50:56:ec:01:a5), Dst: Vmware_23:f2:20 (00:50:56:23:f2:20)
Internet Protocol Version 4, Src: 104.25.10.6 (104.25.10.6), Dst: 192.168.73.3 (192.168.73.3)
Transmission Control Protocol, Src Port: https (443), Dst Port: 43002 (43002), Seq: 4141, Ack: 909, Len: 779
[2 Reassembled TCP Segments (757 bytes): #33(15), #35(742)]
Secure Sockets Layer
Secure Sockets Layer

Frame 36: 54 bytes on wire (432 bits), 54 bytes captured (432 bits) on interface 0
Ethernet II, Src: Vmware_23:f2:20 (00:50:56:23:f2:20), Dst: Vmware_ec:01:a5 (00:50:56:ec:01:a5)
Internet Protocol Version 4, Src: 192.168.73.3 (192.168.73.3), Dst: 104.25.10.6 (104.25.10.6)
Transmission Control Protocol, Src Port: 43002 (43002), Dst Port: https (443), Seq: 909, Ack: 4920, Len: 0

Frame 37: 79 bytes on wire (632 bits), 79 bytes captured (632 bits) on interface 1
Ethernet II, Src: 00:00:00_00:00:00 (00:00:00:00:00:00), Dst: 00:00:00_00:00:00 (00:00:00:00:00:00)
Internet Protocol Version 4, Src: 127.0.0.1 (127.0.0.1), Dst: 127.0.1.1 (127.0.1.1)
User Datagram Protocol, Src Port: 48473 (48473), Dst Port: domain (53)
Domain Name System (query)

Frame 38: 79 bytes on wire (632 bits), 79 bytes captured (632 bits) on interface 1
Ethernet II, Src: 00:00:00_00:00:00 (00:00:00:00:00:00), Dst: 00:00:00_00:00:00 (00:00:00:00:00:00)
Internet Protocol Version 4, Src: 127.0.0.1 (127.0.0.1), Dst: 127.0.1.1 (127.0.1.1)
User Datagram Protocol, Src Port: 48473 (48473), Dst Port: domain (53)
Domain Name System (query)

Frame 39: 129 bytes on wire (1032 bits), 129 bytes captured (1032 bits) on interface 1
Ethernet II, Src: 00:00:00_00:00:00 (00:00:00:00:00:00), Dst: 00:00:00_00:00:00 (00:00:00:00:00:00)
Internet Protocol Version 4, Src: 127.0.1.1 (127.0.1.1), Dst: 127.0.0.1 (127.0.0.1)
User Datagram Protocol, Src Port: domain (53), Dst Port: 48473 (48473)
Domain Name System (response)

Frame 40: 141 bytes on wire (1128 bits), 141 bytes captured (1128 bits) on interface 1
Ethernet II, Src: 00:00:00_00:00:00 (00:00:00:00:00:00), Dst: 00:00:00_00:00:00 (00:00:00:00:00:00)
Internet Protocol Version 4, Src: 127.0.1.1 (127.0.1.1), Dst: 127.0.0.1 (127.0.0.1)
User Datagram Protocol, Src Port: domain (53), Dst Port: 48473 (48473)
Domain Name System (response)

Frame 41: 74 bytes on wire (592 bits), 74 bytes captured (592 bits) on interface 1
Ethernet II, Src: 00:00:00_00:00:00 (00:00:00:00:00:00), Dst: 00:00:00_00:00:00 (00:00:00:00:00:00)
Internet Protocol Version 4, Src: 127.0.0.1 (127.0.0.1), Dst: 127.0.1.1 (127.0.1.1)
User Datagram Protocol, Src Port: 51968 (51968), Dst Port: domain (53)
Domain Name System (query)

Frame 42: 74 bytes on wire (592 bits), 74 bytes captured (592 bits) on interface 1
Ethernet II, Src: 00:00:00_00:00:00 (00:00:00:00:00:00), Dst: 00:00:00_00:00:00 (00:00:00:00:00:00)
Internet Protocol Version 4, Src: 127.0.0.1 (127.0.0.1), Dst: 127.0.1.1 (127.0.1.1)
User Datagram Protocol, Src Port: 51968 (51968), Dst Port: domain (53)
Domain Name System (query)

Frame 43: 170 bytes on wire (1360 bits), 170 bytes captured (1360 bits) on interface 1
Ethernet II, Src: 00:00:00_00:00:00 (00:00:00:00:00:00), Dst: 00:00:00_00:00:00 (00:00:00:00:00:00)
Internet Protocol Version 4, Src: 127.0.1.1 (127.0.1.1), Dst: 127.0.0.1 (127.0.0.1)
User Datagram Protocol, Src Port: domain (53), Dst Port: 51968 (51968)
Domain Name System (response)

Frame 44: 102 bytes on wire (816 bits), 102 bytes captured (816 bits) on interface 1
Ethernet II, Src: 00:00:00_00:00:00 (00:00:00:00:00:00), Dst: 00:00:00_00:00:00 (00:00:00:00:00:00)
Internet Protocol Version 4, Src: 127.0.1.1 (127.0.1.1), Dst: 127.0.0.1 (127.0.0.1)
User Datagram Protocol, Src Port: domain (53), Dst Port: 51968 (51968)
Domain Name System (response)

Frame 45: 79 bytes on wire (632 bits), 79 bytes captured (632 bits) on interface 0
Ethernet II, Src: Vmware_23:f2:20 (00:50:56:23:f2:20), Dst: Vmware_ec:01:a5 (00:50:56:ec:01:a5)
Internet Protocol Version 4, Src: 192.168.73.3 (192.168.73.3), Dst: 192.168.73.2 (192.168.73.2)
User Datagram Protocol, Src Port: 36866 (36866), Dst Port: domain (53)
Domain Name System (query)

Frame 46: 79 bytes on wire (632 bits), 79 bytes captured (632 bits) on interface 0
Ethernet II, Src: Vmware_23:f2:20 (00:50:56:23:f2:20), Dst: Vmware_ec:01:a5 (00:50:56:ec:01:a5)
Internet Protocol Version 4, Src: 192.168.73.3 (192.168.73.3), Dst: 192.168.73.2 (192.168.73.2)
User Datagram Protocol, Src Port: 11849 (11849), Dst Port: domain (53)
Domain Name System (query)

Frame 47: 129 bytes on wire (1032 bits), 129 bytes captured (1032 bits) on interface 0
Ethernet II, Src: Vmware_ec:01:a5 (00:50:56:ec:01:a5), Dst: Vmware_23:f2:20 (00:50:56:23:f2:20)
Internet Protocol Version 4, Src: 192.168.73.2 (192.168.73.2), Dst: 192.168.73.3 (192.168.73.3)
User Datagram Protocol, Src Port: domain (53), Dst Port: 36866 (36866)
Domain Name System (response)

Frame 48: 141 bytes on wire (1128 bits), 141 bytes captured (1128 bits) on interface 0
Ethernet II, Src: Vmware_ec:01:a5 (00:50:56:ec:01:a5), Dst: Vmware_23:f2:20 (00:50:56:23:f2:20)
Internet Protocol Version 4, Src: 192.168.73.2 (192.168.73.2), Dst: 192.168.73.3 (192.168.73.3)
User Datagram Protocol, Src Port: domain (53), Dst Port: 11849 (11849)
Domain Name System (response)

Frame 49: 74 bytes on wire (592 bits), 74 bytes captured (592 bits) on interface 0
Ethernet II, Src: Vmware_23:f2:20 (00:50:56:23:f2:20), Dst: Vmware_ec:01:a5 (00:50:56:ec:01:a5)
Internet Protocol Version 4, Src: 192.168.73.3 (192.168.73.3), Dst: 192.168.73.2 (192.168.73.2)
User Datagram Protocol, Src Port: 4384 (4384), Dst Port: domain (53)
Domain Name System (query)

Frame 50: 74 bytes on wire (592 bits), 74 bytes captured (592 bits) on interface 0
Ethernet II, Src: Vmware_23:f2:20 (00:50:56:23:f2:20), Dst: Vmware_ec:01:a5 (00:50:56:ec:01:a5)
Internet Protocol Version 4, Src: 192.168.73.3 (192.168.73.3), Dst: 192.168.73.2 (192.168.73.2)
User Datagram Protocol, Src Port: mc-brk-srv (3180), Dst Port: domain (53)
Domain Name System (query)

Frame 51: 494 bytes on wire (3952 bits), 494 bytes captured (3952 bits) on interface 0
Ethernet II, Src: Vmware_23:f2:20 (00:50:56:23:f2:20), Dst: Vmware_ec:01:a5 (00:50:56:ec:01:a5)
Internet Protocol Version 4, Src: 192.168.73.3 (192.168.73.3), Dst: 173.194.204.95 (173.194.204.95)
Transmission Control Protocol, Src Port: 60583 (60583), Dst Port: https (443), Seq: 1, Ack: 1, Len: 440
Secure Sockets Layer

Frame 52: 60 bytes on wire (480 bits), 60 bytes captured (480 bits) on interface 0
Ethernet II, Src: Vmware_ec:01:a5 (00:50:56:ec:01:a5), Dst: Vmware_23:f2:20 (00:50:56:23:f2:20)
Internet Protocol Version 4, Src: 173.194.204.95 (173.194.204.95), Dst: 192.168.73.3 (192.168.73.3)
Transmission Control Protocol, Src Port: https (443), Dst Port: 60583 (60583), Seq: 1, Ack: 441, Len: 0

Frame 53: 170 bytes on wire (1360 bits), 170 bytes captured (1360 bits) on interface 0
Ethernet II, Src: Vmware_ec:01:a5 (00:50:56:ec:01:a5), Dst: Vmware_23:f2:20 (00:50:56:23:f2:20)
Internet Protocol Version 4, Src: 192.168.73.2 (192.168.73.2), Dst: 192.168.73.3 (192.168.73.3)
User Datagram Protocol, Src Port: domain (53), Dst Port: 4384 (4384)
Domain Name System (response)

Frame 54: 102 bytes on wire (816 bits), 102 bytes captured (816 bits) on interface 0
Ethernet II, Src: Vmware_ec:01:a5 (00:50:56:ec:01:a5), Dst: Vmware_23:f2:20 (00:50:56:23:f2:20)
Internet Protocol Version 4, Src: 192.168.73.2 (192.168.73.2), Dst: 192.168.73.3 (192.168.73.3)
User Datagram Protocol, Src Port: domain (53), Dst Port: mc-brk-srv (3180)
Domain Name System (response)

Frame 55: 1825 bytes on wire (14600 bits), 1825 bytes captured (14600 bits) on interface 0
Ethernet II, Src: Vmware_ec:01:a5 (00:50:56:ec:01:a5), Dst: Vmware_23:f2:20 (00:50:56:23:f2:20)
Internet Protocol Version 4, Src: 173.194.204.95 (173.194.204.95), Dst: 192.168.73.3 (192.168.73.3)
Transmission Control Protocol, Src Port: https (443), Dst Port: 60583 (60583), Seq: 1, Ack: 441, Len: 1771
Secure Sockets Layer

Frame 56: 54 bytes on wire (432 bits), 54 bytes captured (432 bits) on interface 0
Ethernet II, Src: Vmware_23:f2:20 (00:50:56:23:f2:20), Dst: Vmware_ec:01:a5 (00:50:56:ec:01:a5)
Internet Protocol Version 4, Src: 192.168.73.3 (192.168.73.3), Dst: 173.194.204.95 (173.194.204.95)
Transmission Control Protocol, Src Port: 60583 (60583), Dst Port: https (443), Seq: 441, Ack: 1772, Len: 0

Frame 57: 95 bytes on wire (760 bits), 95 bytes captured (760 bits) on interface 0
Ethernet II, Src: Vmware_23:f2:20 (00:50:56:23:f2:20), Dst: Vmware_ec:01:a5 (00:50:56:ec:01:a5)
Internet Protocol Version 4, Src: 192.168.73.3 (192.168.73.3), Dst: 173.194.204.95 (173.194.204.95)
Transmission Control Protocol, Src Port: 60583 (60583), Dst Port: https (443), Seq: 441, Ack: 1772, Len: 41
Secure Sockets Layer

Frame 58: 60 bytes on wire (480 bits), 60 bytes captured (480 bits) on interface 0
Ethernet II, Src: Vmware_ec:01:a5 (00:50:56:ec:01:a5), Dst: Vmware_23:f2:20 (00:50:56:23:f2:20)
Internet Protocol Version 4, Src: 173.194.204.95 (173.194.204.95), Dst: 192.168.73.3 (192.168.73.3)
Transmission Control Protocol, Src Port: https (443), Dst Port: 60583 (60583), Seq: 1772, Ack: 482, Len: 0

Frame 59: 54 bytes on wire (432 bits), 54 bytes captured (432 bits) on interface 0
Ethernet II, Src: Vmware_23:f2:20 (00:50:56:23:f2:20), Dst: Vmware_ec:01:a5 (00:50:56:ec:01:a5)
Internet Protocol Version 4, Src: 192.168.73.3 (192.168.73.3), Dst: 208.89.14.135 (208.89.14.135)
Transmission Control Protocol, Src Port: 33906 (33906), Dst Port: http (80), Seq: 0, Ack: 555, Len: 0

Frame 60: 60 bytes on wire (480 bits), 60 bytes captured (480 bits) on interface 0
Ethernet II, Src: Vmware_ec:01:a5 (00:50:56:ec:01:a5), Dst: Vmware_23:f2:20 (00:50:56:23:f2:20)
Internet Protocol Version 4, Src: 208.89.14.135 (208.89.14.135), Dst: 192.168.73.3 (192.168.73.3)
Transmission Control Protocol, Src Port: http (80), Dst Port: 33906 (33906), Seq: 555, Ack: 1, Len: 0

Frame 61: 80 bytes on wire (640 bits), 80 bytes captured (640 bits) on interface 1
Ethernet II, Src: 00:00:00_00:00:00 (00:00:00:00:00:00), Dst: 00:00:00_00:00:00 (00:00:00:00:00:00)
Internet Protocol Version 4, Src: 127.0.0.1 (127.0.0.1), Dst: 127.0.1.1 (127.0.1.1)
User Datagram Protocol, Src Port: 44247 (44247), Dst Port: domain (53)
Domain Name System (query)

Frame 62: 80 bytes on wire (640 bits), 80 bytes captured (640 bits) on interface 1
Ethernet II, Src: 00:00:00_00:00:00 (00:00:00:00:00:00), Dst: 00:00:00_00:00:00 (00:00:00:00:00:00)
Internet Protocol Version 4, Src: 127.0.0.1 (127.0.0.1), Dst: 127.0.1.1 (127.0.1.1)
User Datagram Protocol, Src Port: 44247 (44247), Dst Port: domain (53)
Domain Name System (query)

Frame 63: 96 bytes on wire (768 bits), 96 bytes captured (768 bits) on interface 1
Ethernet II, Src: 00:00:00_00:00:00 (00:00:00:00:00:00), Dst: 00:00:00_00:00:00 (00:00:00:00:00:00)
Internet Protocol Version 4, Src: 127.0.1.1 (127.0.1.1), Dst: 127.0.0.1 (127.0.0.1)
User Datagram Protocol, Src Port: domain (53), Dst Port: 44247 (44247)
Domain Name System (response)

Frame 64: 146 bytes on wire (1168 bits), 146 bytes captured (1168 bits) on interface 1
Ethernet II, Src: 00:00:00_00:00:00 (00:00:00:00:00:00), Dst: 00:00:00_00:00:00 (00:00:00:00:00:00)
Internet Protocol Version 4, Src: 127.0.1.1 (127.0.1.1), Dst: 127.0.0.1 (127.0.0.1)
User Datagram Protocol, Src Port: domain (53), Dst Port: 44247 (44247)
Domain Name System (response)

Frame 65: 80 bytes on wire (640 bits), 80 bytes captured (640 bits) on interface 0
Ethernet II, Src: Vmware_23:f2:20 (00:50:56:23:f2:20), Dst: Vmware_ec:01:a5 (00:50:56:ec:01:a5)
Internet Protocol Version 4, Src: 192.168.73.3 (192.168.73.3), Dst: 192.168.73.2 (192.168.73.2)
User Datagram Protocol, Src Port: 33302 (33302), Dst Port: domain (53)
Domain Name System (query)

Frame 66: 80 bytes on wire (640 bits), 80 bytes captured (640 bits) on interface 0
Ethernet II, Src: Vmware_23:f2:20 (00:50:56:23:f2:20), Dst: Vmware_ec:01:a5 (00:50:56:ec:01:a5)
Internet Protocol Version 4, Src: 192.168.73.3 (192.168.73.3), Dst: 192.168.73.2 (192.168.73.2)
User Datagram Protocol, Src Port: 9614 (9614), Dst Port: domain (53)
Domain Name System (query)

Frame 67: 716 bytes on wire (5728 bits), 716 bytes captured (5728 bits) on interface 0
Ethernet II, Src: Vmware_23:f2:20 (00:50:56:23:f2:20), Dst: Vmware_ec:01:a5 (00:50:56:ec:01:a5)
Internet Protocol Version 4, Src: 192.168.73.3 (192.168.73.3), Dst: 208.89.14.135 (208.89.14.135)
Transmission Control Protocol, Src Port: 33906 (33906), Dst Port: http (80), Seq: 1, Ack: 555, Len: 662
Hypertext Transfer Protocol

Frame 68: 60 bytes on wire (480 bits), 60 bytes captured (480 bits) on interface 0
Ethernet II, Src: Vmware_ec:01:a5 (00:50:56:ec:01:a5), Dst: Vmware_23:f2:20 (00:50:56:23:f2:20)
Internet Protocol Version 4, Src: 208.89.14.135 (208.89.14.135), Dst: 192.168.73.3 (192.168.73.3)
Transmission Control Protocol, Src Port: http (80), Dst Port: 33906 (33906), Seq: 555, Ack: 663, Len: 0

Frame 69: 146 bytes on wire (1168 bits), 146 bytes captured (1168 bits) on interface 0
Ethernet II, Src: Vmware_ec:01:a5 (00:50:56:ec:01:a5), Dst: Vmware_23:f2:20 (00:50:56:23:f2:20)
Internet Protocol Version 4, Src: 192.168.73.2 (192.168.73.2), Dst: 192.168.73.3 (192.168.73.3)
User Datagram Protocol, Src Port: domain (53), Dst Port: 9614 (9614)
Domain Name System (response)

Frame 70: 96 bytes on wire (768 bits), 96 bytes captured (768 bits) on interface 0
Ethernet II, Src: Vmware_ec:01:a5 (00:50:56:ec:01:a5), Dst: Vmware_23:f2:20 (00:50:56:23:f2:20)
Internet Protocol Version 4, Src: 192.168.73.2 (192.168.73.2), Dst: 192.168.73.3 (192.168.73.3)
User Datagram Protocol, Src Port: domain (53), Dst Port: 33302 (33302)
Domain Name System (response)

Frame 71: 608 bytes on wire (4864 bits), 608 bytes captured (4864 bits) on interface 0
Ethernet II, Src: Vmware_ec:01:a5 (00:50:56:ec:01:a5), Dst: Vmware_23:f2:20 (00:50:56:23:f2:20)
Internet Protocol Version 4, Src: 208.89.14.135 (208.89.14.135), Dst: 192.168.73.3 (192.168.73.3)
Transmission Control Protocol, Src Port: http (80), Dst Port: 33906 (33906), Seq: 555, Ack: 663, Len: 554
Hypertext Transfer Protocol
Line-based text data: application/x-javascript

Frame 72: 54 bytes on wire (432 bits), 54 bytes captured (432 bits) on interface 0
Ethernet II, Src: Vmware_23:f2:20 (00:50:56:23:f2:20), Dst: Vmware_ec:01:a5 (00:50:56:ec:01:a5)
Internet Protocol Version 4, Src: 192.168.73.3 (192.168.73.3), Dst: 208.89.14.135 (208.89.14.135)
Transmission Control Protocol, Src Port: 33906 (33906), Dst Port: http (80), Seq: 663, Ack: 1109, Len: 0

Frame 73: 84 bytes on wire (672 bits), 84 bytes captured (672 bits) on interface 1
Ethernet II, Src: 00:00:00_00:00:00 (00:00:00:00:00:00), Dst: 00:00:00_00:00:00 (00:00:00:00:00:00)
Internet Protocol Version 4, Src: 127.0.0.1 (127.0.0.1), Dst: 127.0.1.1 (127.0.1.1)
User Datagram Protocol, Src Port: 57922 (57922), Dst Port: domain (53)
Domain Name System (query)

Frame 74: 84 bytes on wire (672 bits), 84 bytes captured (672 bits) on interface 1
Ethernet II, Src: 00:00:00_00:00:00 (00:00:00:00:00:00), Dst: 00:00:00_00:00:00 (00:00:00:00:00:00)
Internet Protocol Version 4, Src: 127.0.0.1 (127.0.0.1), Dst: 127.0.1.1 (127.0.1.1)
User Datagram Protocol, Src Port: 57922 (57922), Dst Port: domain (53)
Domain Name System (query)

Frame 75: 144 bytes on wire (1152 bits), 144 bytes captured (1152 bits) on interface 1
Ethernet II, Src: 00:00:00_00:00:00 (00:00:00:00:00:00), Dst: 00:00:00_00:00:00 (00:00:00:00:00:00)
Internet Protocol Version 4, Src: 127.0.1.1 (127.0.1.1), Dst: 127.0.0.1 (127.0.0.1)
User Datagram Protocol, Src Port: domain (53), Dst Port: 57922 (57922)
Domain Name System (response)

Frame 76: 156 bytes on wire (1248 bits), 156 bytes captured (1248 bits) on interface 1
Ethernet II, Src: 00:00:00_00:00:00 (00:00:00:00:00:00), Dst: 00:00:00_00:00:00 (00:00:00:00:00:00)
Internet Protocol Version 4, Src: 127.0.1.1 (127.0.1.1), Dst: 127.0.0.1 (127.0.0.1)
User Datagram Protocol, Src Port: domain (53), Dst Port: 57922 (57922)
Domain Name System (response)

Frame 77: 84 bytes on wire (672 bits), 84 bytes captured (672 bits) on interface 0
Ethernet II, Src: Vmware_23:f2:20 (00:50:56:23:f2:20), Dst: Vmware_ec:01:a5 (00:50:56:ec:01:a5)
Internet Protocol Version 4, Src: 192.168.73.3 (192.168.73.3), Dst: 192.168.73.2 (192.168.73.2)
User Datagram Protocol, Src Port: 8731 (8731), Dst Port: domain (53)
Domain Name System (query)

Frame 78: 84 bytes on wire (672 bits), 84 bytes captured (672 bits) on interface 0
Ethernet II, Src: Vmware_23:f2:20 (00:50:56:23:f2:20), Dst: Vmware_ec:01:a5 (00:50:56:ec:01:a5)
Internet Protocol Version 4, Src: 192.168.73.3 (192.168.73.3), Dst: 192.168.73.2 (192.168.73.2)
User Datagram Protocol, Src Port: 6449 (6449), Dst Port: domain (53)
Domain Name System (query)

Frame 79: 156 bytes on wire (1248 bits), 156 bytes captured (1248 bits) on interface 0
Ethernet II, Src: Vmware_ec:01:a5 (00:50:56:ec:01:a5), Dst: Vmware_23:f2:20 (00:50:56:23:f2:20)
Internet Protocol Version 4, Src: 192.168.73.2 (192.168.73.2), Dst: 192.168.73.3 (192.168.73.3)
User Datagram Protocol, Src Port: domain (53), Dst Port: 6449 (6449)
Domain Name System (response)

Frame 80: 144 bytes on wire (1152 bits), 144 bytes captured (1152 bits) on interface 0
Ethernet II, Src: Vmware_ec:01:a5 (00:50:56:ec:01:a5), Dst: Vmware_23:f2:20 (00:50:56:23:f2:20)
Internet Protocol Version 4, Src: 192.168.73.2 (192.168.73.2), Dst: 192.168.73.3 (192.168.73.3)
User Datagram Protocol, Src Port: domain (53), Dst Port: 8731 (8731)
Domain Name System (response)

Frame 81: 976 bytes on wire (7808 bits), 976 bytes captured (7808 bits) on interface 0
Ethernet II, Src: Vmware_23:f2:20 (00:50:56:23:f2:20), Dst: Vmware_ec:01:a5 (00:50:56:ec:01:a5)
Internet Protocol Version 4, Src: 192.168.73.3 (192.168.73.3), Dst: 74.125.226.190 (74.125.226.190)
Transmission Control Protocol, Src Port: 59292 (59292), Dst Port: https (443), Seq: 1, Ack: 1, Len: 922
Secure Sockets Layer

Frame 82: 60 bytes on wire (480 bits), 60 bytes captured (480 bits) on interface 0
Ethernet II, Src: Vmware_ec:01:a5 (00:50:56:ec:01:a5), Dst: Vmware_23:f2:20 (00:50:56:23:f2:20)
Internet Protocol Version 4, Src: 74.125.226.190 (74.125.226.190), Dst: 192.168.73.3 (192.168.73.3)
Transmission Control Protocol, Src Port: https (443), Dst Port: 59292 (59292), Seq: 1, Ack: 923, Len: 0

Frame 83: 54 bytes on wire (432 bits), 54 bytes captured (432 bits) on interface 0
Ethernet II, Src: Vmware_23:f2:20 (00:50:56:23:f2:20), Dst: Vmware_ec:01:a5 (00:50:56:ec:01:a5)
Internet Protocol Version 4, Src: 192.168.73.3 (192.168.73.3), Dst: 104.97.73.208 (104.97.73.208)
Transmission Control Protocol, Src Port: 43051 (43051), Dst Port: http (80), Seq: 1, Ack: 1, Len: 0

Frame 84: 60 bytes on wire (480 bits), 60 bytes captured (480 bits) on interface 0
Ethernet II, Src: Vmware_ec:01:a5 (00:50:56:ec:01:a5), Dst: Vmware_23:f2:20 (00:50:56:23:f2:20)
Internet Protocol Version 4, Src: 104.97.73.208 (104.97.73.208), Dst: 192.168.73.3 (192.168.73.3)
Transmission Control Protocol, Src Port: http (80), Dst Port: 43051 (43051), Seq: 1, Ack: 2, Len: 0

Frame 85: 226 bytes on wire (1808 bits), 226 bytes captured (1808 bits) on interface 0
Ethernet II, Src: Vmware_ec:01:a5 (00:50:56:ec:01:a5), Dst: Vmware_23:f2:20 (00:50:56:23:f2:20)
Internet Protocol Version 4, Src: 74.125.226.190 (74.125.226.190), Dst: 192.168.73.3 (192.168.73.3)
Transmission Control Protocol, Src Port: https (443), Dst Port: 59292 (59292), Seq: 1, Ack: 923, Len: 172
Secure Sockets Layer

Frame 86: 54 bytes on wire (432 bits), 54 bytes captured (432 bits) on interface 0
Ethernet II, Src: Vmware_23:f2:20 (00:50:56:23:f2:20), Dst: Vmware_ec:01:a5 (00:50:56:ec:01:a5)
Internet Protocol Version 4, Src: 192.168.73.3 (192.168.73.3), Dst: 74.125.226.190 (74.125.226.190)
Transmission Control Protocol, Src Port: 59292 (59292), Dst Port: https (443), Seq: 923, Ack: 173, Len: 0

Frame 87: 95 bytes on wire (760 bits), 95 bytes captured (760 bits) on interface 0
Ethernet II, Src: Vmware_23:f2:20 (00:50:56:23:f2:20), Dst: Vmware_ec:01:a5 (00:50:56:ec:01:a5)
Internet Protocol Version 4, Src: 192.168.73.3 (192.168.73.3), Dst: 74.125.226.190 (74.125.226.190)
Transmission Control Protocol, Src Port: 59292 (59292), Dst Port: https (443), Seq: 923, Ack: 173, Len: 41
Secure Sockets Layer

Frame 88: 60 bytes on wire (480 bits), 60 bytes captured (480 bits) on interface 0
Ethernet II, Src: Vmware_ec:01:a5 (00:50:56:ec:01:a5), Dst: Vmware_23:f2:20 (00:50:56:23:f2:20)
Internet Protocol Version 4, Src: 74.125.226.190 (74.125.226.190), Dst: 192.168.73.3 (192.168.73.3)
Transmission Control Protocol, Src Port: https (443), Dst Port: 59292 (59292), Seq: 173, Ack: 964, Len: 0

Frame 89: 54 bytes on wire (432 bits), 54 bytes captured (432 bits) on interface 0
Ethernet II, Src: Vmware_23:f2:20 (00:50:56:23:f2:20), Dst: Vmware_ec:01:a5 (00:50:56:ec:01:a5)
Internet Protocol Version 4, Src: 192.168.73.3 (192.168.73.3), Dst: 52.84.33.92 (52.84.33.92)
Transmission Control Protocol, Src Port: 45679 (45679), Dst Port: http (80), Seq: 1, Ack: 1, Len: 0

Frame 90: 60 bytes on wire (480 bits), 60 bytes captured (480 bits) on interface 0
Ethernet II, Src: Vmware_ec:01:a5 (00:50:56:ec:01:a5), Dst: Vmware_23:f2:20 (00:50:56:23:f2:20)
Internet Protocol Version 4, Src: 52.84.33.92 (52.84.33.92), Dst: 192.168.73.3 (192.168.73.3)
Transmission Control Protocol, Src Port: http (80), Dst Port: 45679 (45679), Seq: 1, Ack: 2, Len: 0

Frame 91: 54 bytes on wire (432 bits), 54 bytes captured (432 bits) on interface 0
Ethernet II, Src: Vmware_23:f2:20 (00:50:56:23:f2:20), Dst: Vmware_ec:01:a5 (00:50:56:ec:01:a5)
Internet Protocol Version 4, Src: 192.168.73.3 (192.168.73.3), Dst: 216.58.219.206 (216.58.219.206)
Transmission Control Protocol, Src Port: 47855 (47855), Dst Port: http (80), Seq: 1, Ack: 1, Len: 0

Frame 92: 60 bytes on wire (480 bits), 60 bytes captured (480 bits) on interface 0
Ethernet II, Src: Vmware_ec:01:a5 (00:50:56:ec:01:a5), Dst: Vmware_23:f2:20 (00:50:56:23:f2:20)
Internet Protocol Version 4, Src: 216.58.219.206 (216.58.219.206), Dst: 192.168.73.3 (192.168.73.3)
Transmission Control Protocol, Src Port: http (80), Dst Port: 47855 (47855), Seq: 1, Ack: 2, Len: 0

Frame 93: 54 bytes on wire (432 bits), 54 bytes captured (432 bits) on interface 0
Ethernet II, Src: Vmware_23:f2:20 (00:50:56:23:f2:20), Dst: Vmware_ec:01:a5 (00:50:56:ec:01:a5)
Internet Protocol Version 4, Src: 192.168.73.3 (192.168.73.3), Dst: 199.16.156.75 (199.16.156.75)
Transmission Control Protocol, Src Port: 39730 (39730), Dst Port: http (80), Seq: 1, Ack: 1, Len: 0

Frame 94: 60 bytes on wire (480 bits), 60 bytes captured (480 bits) on interface 0
Ethernet II, Src: Vmware_ec:01:a5 (00:50:56:ec:01:a5), Dst: Vmware_23:f2:20 (00:50:56:23:f2:20)
Internet Protocol Version 4, Src: 199.16.156.75 (199.16.156.75), Dst: 192.168.73.3 (192.168.73.3)
Transmission Control Protocol, Src Port: http (80), Dst Port: 39730 (39730), Seq: 1, Ack: 2, Len: 0

Frame 95: 54 bytes on wire (432 bits), 54 bytes captured (432 bits) on interface 0
Ethernet II, Src: Vmware_23:f2:20 (00:50:56:23:f2:20), Dst: Vmware_ec:01:a5 (00:50:56:ec:01:a5)
Internet Protocol Version 4, Src: 192.168.73.3 (192.168.73.3), Dst: 173.194.123.58 (173.194.123.58)
Transmission Control Protocol, Src Port: 55259 (55259), Dst Port: http (80), Seq: 1, Ack: 1, Len: 0

Frame 96: 60 bytes on wire (480 bits), 60 bytes captured (480 bits) on interface 0
Ethernet II, Src: Vmware_ec:01:a5 (00:50:56:ec:01:a5), Dst: Vmware_23:f2:20 (00:50:56:23:f2:20)
Internet Protocol Version 4, Src: 173.194.123.58 (173.194.123.58), Dst: 192.168.73.3 (192.168.73.3)
Transmission Control Protocol, Src Port: http (80), Dst Port: 55259 (55259), Seq: 1, Ack: 2, Len: 0

Frame 97: 54 bytes on wire (432 bits), 54 bytes captured (432 bits) on interface 0
Ethernet II, Src: Vmware_23:f2:20 (00:50:56:23:f2:20), Dst: Vmware_ec:01:a5 (00:50:56:ec:01:a5)
Internet Protocol Version 4, Src: 192.168.73.3 (192.168.73.3), Dst: 173.194.206.104 (173.194.206.104)
Transmission Control Protocol, Src Port: 33020 (33020), Dst Port: http (80), Seq: 1, Ack: 1, Len: 0

Frame 98: 60 bytes on wire (480 bits), 60 bytes captured (480 bits) on interface 0
Ethernet II, Src: Vmware_ec:01:a5 (00:50:56:ec:01:a5), Dst: Vmware_23:f2:20 (00:50:56:23:f2:20)
Internet Protocol Version 4, Src: 173.194.206.104 (173.194.206.104), Dst: 192.168.73.3 (192.168.73.3)
Transmission Control Protocol, Src Port: http (80), Dst Port: 33020 (33020), Seq: 1, Ack: 2, Len: 0

Frame 99: 1034 bytes on wire (8272 bits), 1034 bytes captured (8272 bits) on interface 0
Ethernet II, Src: Vmware_23:f2:20 (00:50:56:23:f2:20), Dst: Vmware_ec:01:a5 (00:50:56:ec:01:a5)
Internet Protocol Version 4, Src: 192.168.73.3 (192.168.73.3), Dst: 173.194.206.101 (173.194.206.101)
Transmission Control Protocol, Src Port: 36561 (36561), Dst Port: https (443), Seq: 1, Ack: 1, Len: 980
Secure Sockets Layer

Frame 100: 60 bytes on wire (480 bits), 60 bytes captured (480 bits) on interface 0
Ethernet II, Src: Vmware_ec:01:a5 (00:50:56:ec:01:a5), Dst: Vmware_23:f2:20 (00:50:56:23:f2:20)
Internet Protocol Version 4, Src: 173.194.206.101 (173.194.206.101), Dst: 192.168.73.3 (192.168.73.3)
Transmission Control Protocol, Src Port: https (443), Dst Port: 36561 (36561), Seq: 1, Ack: 981, Len: 0

Frame 101: 190 bytes on wire (1520 bits), 190 bytes captured (1520 bits) on interface 0
Ethernet II, Src: Vmware_ec:01:a5 (00:50:56:ec:01:a5), Dst: Vmware_23:f2:20 (00:50:56:23:f2:20)
Internet Protocol Version 4, Src: 173.194.206.101 (173.194.206.101), Dst: 192.168.73.3 (192.168.73.3)
Transmission Control Protocol, Src Port: https (443), Dst Port: 36561 (36561), Seq: 1, Ack: 981, Len: 136
Secure Sockets Layer

Frame 102: 95 bytes on wire (760 bits), 95 bytes captured (760 bits) on interface 0
Ethernet II, Src: Vmware_23:f2:20 (00:50:56:23:f2:20), Dst: Vmware_ec:01:a5 (00:50:56:ec:01:a5)
Internet Protocol Version 4, Src: 192.168.73.3 (192.168.73.3), Dst: 173.194.206.101 (173.194.206.101)
Transmission Control Protocol, Src Port: 36561 (36561), Dst Port: https (443), Seq: 981, Ack: 137, Len: 41
Secure Sockets Layer

Frame 103: 60 bytes on wire (480 bits), 60 bytes captured (480 bits) on interface 0
Ethernet II, Src: Vmware_ec:01:a5 (00:50:56:ec:01:a5), Dst: Vmware_23:f2:20 (00:50:56:23:f2:20)
Internet Protocol Version 4, Src: 173.194.206.101 (173.194.206.101), Dst: 192.168.73.3 (192.168.73.3)
Transmission Control Protocol, Src Port: https (443), Dst Port: 36561 (36561), Seq: 137, Ack: 1022, Len: 0

Frame 104: 54 bytes on wire (432 bits), 54 bytes captured (432 bits) on interface 0
Ethernet II, Src: Vmware_23:f2:20 (00:50:56:23:f2:20), Dst: Vmware_ec:01:a5 (00:50:56:ec:01:a5)
Internet Protocol Version 4, Src: 192.168.73.3 (192.168.73.3), Dst: 199.187.193.130 (199.187.193.130)
Transmission Control Protocol, Src Port: 57204 (57204), Dst Port: http (80), Seq: 1, Ack: 1, Len: 0

Frame 105: 60 bytes on wire (480 bits), 60 bytes captured (480 bits) on interface 0
Ethernet II, Src: Vmware_ec:01:a5 (00:50:56:ec:01:a5), Dst: Vmware_23:f2:20 (00:50:56:23:f2:20)
Internet Protocol Version 4, Src: 199.187.193.130 (199.187.193.130), Dst: 192.168.73.3 (192.168.73.3)
Transmission Control Protocol, Src Port: http (80), Dst Port: 57204 (57204), Seq: 1, Ack: 2, Len: 0

Frame 106: 54 bytes on wire (432 bits), 54 bytes captured (432 bits) on interface 0
Ethernet II, Src: Vmware_23:f2:20 (00:50:56:23:f2:20), Dst: Vmware_ec:01:a5 (00:50:56:ec:01:a5)
Internet Protocol Version 4, Src: 192.168.73.3 (192.168.73.3), Dst: 52.84.27.118 (52.84.27.118)
Transmission Control Protocol, Src Port: 36886 (36886), Dst Port: http (80), Seq: 1, Ack: 1, Len: 0

Frame 107: 60 bytes on wire (480 bits), 60 bytes captured (480 bits) on interface 0
Ethernet II, Src: Vmware_ec:01:a5 (00:50:56:ec:01:a5), Dst: Vmware_23:f2:20 (00:50:56:23:f2:20)
Internet Protocol Version 4, Src: 52.84.27.118 (52.84.27.118), Dst: 192.168.73.3 (192.168.73.3)
Transmission Control Protocol, Src Port: http (80), Dst Port: 36886 (36886), Seq: 1, Ack: 2, Len: 0

Frame 108: 54 bytes on wire (432 bits), 54 bytes captured (432 bits) on interface 0
Ethernet II, Src: Vmware_23:f2:20 (00:50:56:23:f2:20), Dst: Vmware_ec:01:a5 (00:50:56:ec:01:a5)
Internet Protocol Version 4, Src: 192.168.73.3 (192.168.73.3), Dst: 208.89.14.135 (208.89.14.135)
Transmission Control Protocol, Src Port: 33906 (33906), Dst Port: http (80), Seq: 662, Ack: 1109, Len: 0

Frame 109: 60 bytes on wire (480 bits), 60 bytes captured (480 bits) on interface 0
Ethernet II, Src: Vmware_ec:01:a5 (00:50:56:ec:01:a5), Dst: Vmware_23:f2:20 (00:50:56:23:f2:20)
Internet Protocol Version 4, Src: 208.89.14.135 (208.89.14.135), Dst: 192.168.73.3 (192.168.73.3)
Transmission Control Protocol, Src Port: http (80), Dst Port: 33906 (33906), Seq: 1109, Ack: 663, Len: 0

Frame 110: 54 bytes on wire (432 bits), 54 bytes captured (432 bits) on interface 0
Ethernet II, Src: Vmware_23:f2:20 (00:50:56:23:f2:20), Dst: Vmware_ec:01:a5 (00:50:56:ec:01:a5)
Internet Protocol Version 4, Src: 192.168.73.3 (192.168.73.3), Dst: 104.97.96.245 (104.97.96.245)
Transmission Control Protocol, Src Port: 39122 (39122), Dst Port: http (80), Seq: 1, Ack: 1, Len: 0

Frame 111: 60 bytes on wire (480 bits), 60 bytes captured (480 bits) on interface 0
Ethernet II, Src: Vmware_ec:01:a5 (00:50:56:ec:01:a5), Dst: Vmware_23:f2:20 (00:50:56:23:f2:20)
Internet Protocol Version 4, Src: 104.97.96.245 (104.97.96.245), Dst: 192.168.73.3 (192.168.73.3)
Transmission Control Protocol, Src Port: http (80), Dst Port: 39122 (39122), Seq: 1, Ack: 2, Len: 0

Frame 112: 716 bytes on wire (5728 bits), 716 bytes captured (5728 bits) on interface 0
Ethernet II, Src: Vmware_23:f2:20 (00:50:56:23:f2:20), Dst: Vmware_ec:01:a5 (00:50:56:ec:01:a5)
Internet Protocol Version 4, Src: 192.168.73.3 (192.168.73.3), Dst: 208.89.14.135 (208.89.14.135)
Transmission Control Protocol, Src Port: 33906 (33906), Dst Port: http (80), Seq: 663, Ack: 1109, Len: 662
Hypertext Transfer Protocol

Frame 113: 60 bytes on wire (480 bits), 60 bytes captured (480 bits) on interface 0
Ethernet II, Src: Vmware_ec:01:a5 (00:50:56:ec:01:a5), Dst: Vmware_23:f2:20 (00:50:56:23:f2:20)
Internet Protocol Version 4, Src: 208.89.14.135 (208.89.14.135), Dst: 192.168.73.3 (192.168.73.3)
Transmission Control Protocol, Src Port: http (80), Dst Port: 33906 (33906), Seq: 1109, Ack: 1325, Len: 0

Frame 114: 608 bytes on wire (4864 bits), 608 bytes captured (4864 bits) on interface 0
Ethernet II, Src: Vmware_ec:01:a5 (00:50:56:ec:01:a5), Dst: Vmware_23:f2:20 (00:50:56:23:f2:20)
Internet Protocol Version 4, Src: 208.89.14.135 (208.89.14.135), Dst: 192.168.73.3 (192.168.73.3)
Transmission Control Protocol, Src Port: http (80), Dst Port: 33906 (33906), Seq: 1109, Ack: 1325, Len: 554
Hypertext Transfer Protocol
Line-based text data: application/x-javascript

Frame 115: 54 bytes on wire (432 bits), 54 bytes captured (432 bits) on interface 0
Ethernet II, Src: Vmware_23:f2:20 (00:50:56:23:f2:20), Dst: Vmware_ec:01:a5 (00:50:56:ec:01:a5)
Internet Protocol Version 4, Src: 192.168.73.3 (192.168.73.3), Dst: 208.89.14.135 (208.89.14.135)
Transmission Control Protocol, Src Port: 33906 (33906), Dst Port: http (80), Seq: 1325, Ack: 1663, Len: 0

Frame 116: 54 bytes on wire (432 bits), 54 bytes captured (432 bits) on interface 0
Ethernet II, Src: Vmware_23:f2:20 (00:50:56:23:f2:20), Dst: Vmware_ec:01:a5 (00:50:56:ec:01:a5)
Internet Protocol Version 4, Src: 192.168.73.3 (192.168.73.3), Dst: 52.84.33.92 (52.84.33.92)
Transmission Control Protocol, Src Port: 45679 (45679), Dst Port: http (80), Seq: 1, Ack: 1, Len: 0

Frame 117: 60 bytes on wire (480 bits), 60 bytes captured (480 bits) on interface 0
Ethernet II, Src: Vmware_ec:01:a5 (00:50:56:ec:01:a5), Dst: Vmware_23:f2:20 (00:50:56:23:f2:20)
Internet Protocol Version 4, Src: 52.84.33.92 (52.84.33.92), Dst: 192.168.73.3 (192.168.73.3)
Transmission Control Protocol, Src Port: http (80), Dst Port: 45679 (45679), Seq: 1, Ack: 2, Len: 0

Frame 118: 54 bytes on wire (432 bits), 54 bytes captured (432 bits) on interface 0
Ethernet II, Src: Vmware_23:f2:20 (00:50:56:23:f2:20), Dst: Vmware_ec:01:a5 (00:50:56:ec:01:a5)
Internet Protocol Version 4, Src: 192.168.73.3 (192.168.73.3), Dst: 216.58.219.206 (216.58.219.206)
Transmission Control Protocol, Src Port: 47855 (47855), Dst Port: http (80), Seq: 1, Ack: 1, Len: 0

Frame 119: 60 bytes on wire (480 bits), 60 bytes captured (480 bits) on interface 0
Ethernet II, Src: Vmware_ec:01:a5 (00:50:56:ec:01:a5), Dst: Vmware_23:f2:20 (00:50:56:23:f2:20)
Internet Protocol Version 4, Src: 216.58.219.206 (216.58.219.206), Dst: 192.168.73.3 (192.168.73.3)
Transmission Control Protocol, Src Port: http (80), Dst Port: 47855 (47855), Seq: 1, Ack: 2, Len: 0

Frame 120: 54 bytes on wire (432 bits), 54 bytes captured (432 bits) on interface 0
Ethernet II, Src: Vmware_23:f2:20 (00:50:56:23:f2:20), Dst: Vmware_ec:01:a5 (00:50:56:ec:01:a5)
Internet Protocol Version 4, Src: 192.168.73.3 (192.168.73.3), Dst: 199.16.156.75 (199.16.156.75)
Transmission Control Protocol, Src Port: 39730 (39730), Dst Port: http (80), Seq: 1, Ack: 1, Len: 0

Frame 121: 60 bytes on wire (480 bits), 60 bytes captured (480 bits) on interface 0
Ethernet II, Src: Vmware_ec:01:a5 (00:50:56:ec:01:a5), Dst: Vmware_23:f2:20 (00:50:56:23:f2:20)
Internet Protocol Version 4, Src: 199.16.156.75 (199.16.156.75), Dst: 192.168.73.3 (192.168.73.3)
Transmission Control Protocol, Src Port: http (80), Dst Port: 39730 (39730), Seq: 1, Ack: 2, Len: 0

Frame 122: 54 bytes on wire (432 bits), 54 bytes captured (432 bits) on interface 0
Ethernet II, Src: Vmware_23:f2:20 (00:50:56:23:f2:20), Dst: Vmware_ec:01:a5 (00:50:56:ec:01:a5)
Internet Protocol Version 4, Src: 192.168.73.3 (192.168.73.3), Dst: 173.194.123.58 (173.194.123.58)
Transmission Control Protocol, Src Port: 55259 (55259), Dst Port: http (80), Seq: 1, Ack: 1, Len: 0

Frame 123: 60 bytes on wire (480 bits), 60 bytes captured (480 bits) on interface 0
Ethernet II, Src: Vmware_ec:01:a5 (00:50:56:ec:01:a5), Dst: Vmware_23:f2:20 (00:50:56:23:f2:20)
Internet Protocol Version 4, Src: 173.194.123.58 (173.194.123.58), Dst: 192.168.73.3 (192.168.73.3)
Transmission Control Protocol, Src Port: http (80), Dst Port: 55259 (55259), Seq: 1, Ack: 2, Len: 0
